{
  "eventId": "0190f2a0-0000-7000-8000-000000000019",
  "aggregateId": "0190f2a0-0000-7000-8000-000000000119",
  "occurredAt": "2026-08-13T10:00:00Z",
  "version": 1,
  "clubId": "0190f2a0-0000-7000-8000-00000000c1b0",
  "actorId": "0190f2a0-0000-7000-8000-0000000000ac",
  "traceparent": "00-0af7651916cd43dd8448eb211c80319c-b7ad6b7169203331-01",
  "planId": "0190f2a0-0000-7000-8000-000000000115",
  "dia": "2026-08-17",
  "estado": "PARCIAL",
  "valoracion": 3,
  "motivo": "CANSANCIO",
  "marcaDolor": false
}
